{
  "schemaVersion": 2,
  "id": "W-0001",
  "createdAt": "2000-01-01T00:00:00Z",
  "updatedAt": "2000-01-01T00:00:00Z",
  "revision": 1,
  "createdBy": "manager",
  "updatedBy": "manager",
  "digest": "sha256:0000000000000000000000000000000000000000000000000000000000000000",
  "correlationId": "campaign-open",
  "campaignId": "C-CAMPAIGN",
  "kind": "task",
  "title": "Root work item",
  "problem": "Precise problem statement",
  "state": "ready",
  "priority": "normal",
  "milestones": [],
  "acceptanceCriteria": ["Observable completion condition"],
  "relations": {
    "parentIds": [],
    "childIds": [],
    "dependsOn": [],
    "blockedBy": [],
    "spawnedByIds": []
  },
  "activeRunIds": [],
  "completedRunIds": [],
  "findingIds": [],
  "decisionIds": [],
  "owner": "manager",
  "resumeNote": "Present edge only"
}
